te@pict-OptiPlex-9020:~$ mysql -h 10.10.15.233 -u te31458 -p
Enter password: 
Welcome to the MySQL monitor.  Commands end with ; or \g.
Your MySQL connection id is 168
Server version: 5.5.43-MariaDB MariaDB Server

Copyright (c) 2000, 2023, Oracle and/or its affiliates.

Oracle is a registered trademark of Oracle Corporation and/or its
affiliates. Other names may be trademarks of their respective
owners.

Type 'help;' or '\h' for help. Type '\c' to clear the current input statement.

mysql> show databases;
+--------------------+
| Database           |
+--------------------+
| information_schema |
| 31458_db           |
| test               |
+--------------------+
3 rows in set (0.03 sec)

mysql> use 31458_db;
Reading table information for completion of table and column names
You can turn off this feature to get a quicker startup with -A

Database changed

mysql> insert into department values(150, 'Compueter', 'Pune');
Query OK, 1 row affected (0.02 sec)

mysql> insert into department values(100, 'IT', 'Munbai');
Query OK, 1 row affected (0.02 sec)

mysql> insert into department values(50, 'ENTC', 'Nashik');
Query OK, 1 row affected (0.02 sec)

mysql> insert into employe values(198, 150, 'Donald', 'OConnell', 'Clerk', '2600', '2007-06-21');
Query OK, 1 row affected (0.02 sec)

mysql> insert into employe values(199, 100, 'Jennifer', 'Grant', 'Assistant', '4400', '2003-09-17');
Query OK, 1 row affected (0.02 sec)

mysql> insert into employe values(200, 50, 'Pat', 'Ray', 'Representative', '6000', '2005-08-17');
Query OK, 1 row affected (0.02 sec)

mysql> insert into employe values(201, 150, 'Peter', 'Harstein', 'Manager', '13000', '2004-02-13');
Query OK, 1 row affected (0.02 sec)

mysql> insert into employe values(202, 100, 'Susan', 'Mavris', 'Represenatative', '6500', '2002-06-07Ã¢â‚¬â„¢);
Query OK, 1 row affected (0.02 sec)

mysql> insert into employe values(203, 50, 'Shelly', 'Higgins', 'Manager', '12000', '2002-06-07');
Query OK, 1 row affected (0.02 sec)

mysql> insert into employe values(204, 150, 'William', 'Geitz', 'Accountant', '8300', '2008-01-13');
Query OK, 1 row affected (0.02 sec)

mysql> insert into employe values(205, 100, 'Steven', 'King', 'Clerk', '2600', '2003-07-17');
Query OK, 1 row affected (0.02 sec)

mysql> insert into employe values(206, 50, 'Alexander', 'Hunold', 'Programmer', '9000', '2006-01-03');
Query OK, 1 row affected (0.02 sec)

mysql> insert into employe values(207, 150, 'Bruce', 'Ernst', 'Programmer', '4800', '2021-05-14');
Query OK, 1 row affected (0.02 sec)

mysql> insert into project values(344, 100, 'Expense Tracker', 'Pune', 4000, '2004');
Query OK, 1 row affected (0.02 sec)

mysql> insert into project values(345, 100, 'Health Consultant', 'Mumbai', 5000, '2005');
Query OK, 1 row affected (0.02 sec)

mysql> insert into project values(346, 150, 'Crypto Tracker', 'Mumbai', 6000, '2006');
Query OK, 1 row affected (0.02 sec)

mysql> insert into project values(347, 150, 'Pattern Locking', 'Pune', 7000, '2007');
Query OK, 1 row affected (0.02 sec)

mysql> insert into project values(348, 50, 'File Finder', 'Nashik', 7000, '2007');
Query OK, 1 row affected (0.02 sec)

mysql> insert into project values(349, 50, 'Face Recognition', 'Pune', 800, '2008');
Query OK, 1 row affected (0.02 sec)

mysql> show tables;
+--------------------+
| Tables_in_31458_db |
+--------------------+
| department         |
| employe            |
| project            |
+--------------------+
3 rows in set (0.00 sec)

mysql> select * from project;
+---------+---------+-------------------+---------------+-----------+-----------+
| proj_id | dept_id | proj_name         | proj_location | proj_cost | proj_year |
+---------+---------+-------------------+---------------+-----------+-----------+
|     344 |     100 | Expense Tracker   | Pune          |      4000 |      2004 |
|     345 |     100 | Health Consultant | Mumbai        |      5000 |      2005 |
|     346 |     150 | Crypto Tracker    | Mumbai        |      6000 |      2006 |
|     347 |     150 | Pattern Locking   | Pune          |      7000 |      2007 |
|     348 |      50 | File Finder       | Nashik        |      7000 |      2007 |
|     349 |      50 | Face Recognition  | Pune          |      8000 |      2008 |
+---------+---------+-------------------+---------------+-----------+-----------+
6 rows in set (0.00 sec)

mysql> select * from department;
+---------+-----------+----------+
| dept_id | dept_name | dept_loc |
+---------+-----------+----------+
|      50 | ENTC      | Nashik   |
|     100 | IT        | Mumbai   |
|     150 | Compueter | Pune     |
+---------+-----------+----------+
3 rows in set (0.00 sec)

mysql> select * from employe;
+--------+---------+-----------+-----------+----------------+------------+--------------+
| emp_id | dept_id | emp_fname | emp_lname | emp_pos        | emp_salary | emp_joindate |
+--------+---------+-----------+-----------+----------------+------------+--------------+
|    198 |     150 | Donald    | OConnell  | Clerk          | 2600       | 2007-06-21   |
|    199 |     100 | Jennifer  | Grant     | Assistant      | 4400       | 2003-09-17   |
|    200 |      50 | Pat       | Ray       | Representative | 6000       | 2005-08-17   |
|    201 |     150 | Peter     | Harstein  | Manager        | 13000      | 2004-02-13   |
|    202 |     100 | Harper    | Mavris    | Programmer     | 10000      | 2002-06-07   |
|    203 |      50 | Shelly    | Higgins   | Manager        | 12000      | 2002-06-07   |
|    204 |     150 | William   | Geitz     | Accountant     | 8300       | 2008-01-13   |
|    205 |     100 | Steven    | King      | Clerk          | 2600       | 2003-07-17   |
|    206 |      50 | Alexander | Hunold    | Programmer     | 9000       | 2006-01-03   |
|    207 |     150 | Harry     | Ernst     | Programmer     | 4800       | 2021-05-14   |
+--------+---------+-----------+-----------+----------------+------------+--------------+
10 rows in set (0.00 sec)

mysql> select * from employe where dept_id in (150, 100) and emp_fname like 'P%' or emp_fname like 'H%';
+--------+---------+-----------+-----------+------------+------------+--------------+
| emp_id | dept_id | emp_fname | emp_lname | emp_pos    | emp_salary | emp_joindate |
+--------+---------+-----------+-----------+------------+------------+--------------+
|    201 |     150 | Peter     | Harstein  | Manager    | 13000      | 2004-02-13   |
|    202 |     100 | Harper    | Mavris    | Programmer | 10000      | 2002-06-07   |
|    207 |     150 | Harry     | Ernst     | Programmer | 4800       | 2021-05-14   |
+--------+---------+-----------+-----------+------------+------------+--------------+
3 rows in set (0.01 sec)

mysql> select distinct emp_pos from employe;
+----------------+
| emp_pos        |
+----------------+
| Clerk          |
| Assistant      |
| Representative |
| Manager        |
| Programmer     |
| Accountant     |
+----------------+
6 rows in set (0.00 sec)

mysql> select count(distinct emp_pos) from employe;
+-------------------------+
| count(distinct emp_pos) |
+-------------------------+
|                       6 |
+-------------------------+
1 row in set (0.00 sec)

mysql> update employe
    -> set emp_salary = emp_salary + emp_salary * 0.1
    -> where emp_joindate < '2003-01-01';
Query OK, 2 rows affected (0.04 sec)
Rows matched: 2  Changed: 2  Warnings: 0

mysql> select * from employe;
+--------+---------+-----------+-----------+----------------+------------+--------------+
| emp_id | dept_id | emp_fname | emp_lname | emp_pos        | emp_salary | emp_joindate |
+--------+---------+-----------+-----------+----------------+------------+--------------+
|    198 |     150 | Donald    | OConnell  | Clerk          | 2600       | 2007-06-21   |
|    199 |     100 | Jennifer  | Grant     | Assistant      | 4400       | 2003-09-17   |
|    200 |      50 | Pat       | Ray       | Representative | 6000       | 2005-08-17   |
|    201 |     150 | Peter     | Harstein  | Manager        | 13000      | 2004-02-13   |
|    202 |     100 | Harper    | Mavris    | Programmer     | 11000      | 2002-06-07   |
|    203 |      50 | Shelly    | Higgins   | Manager        | 13200      | 2002-06-07   |
|    204 |     150 | William   | Geitz     | Accountant     | 8300       | 2008-01-13   |
|    205 |     100 | Steven    | King      | Clerk          | 2600       | 2003-07-17   |
|    206 |      50 | Alexander | Hunold    | Programmer     | 9000       | 2006-01-03   |
|    207 |     150 | Harry     | Ernst     | Programmer     | 4800       | 2021-05-14   |
+--------+---------+-----------+-----------+----------------+------------+--------------+
10 rows in set (0.00 sec)

mysql> set foreign_key_checks = 0;
Query OK, 0 rows affected (0.00 sec)

mysql> delete from department
    -> where dept_loc = 'Mumbai';
Query OK, 1 row affected (0.02 sec)

mysql> select * from department;
+---------+-----------+----------+
| dept_id | dept_name | dept_loc |
+---------+-----------+----------+
|      50 | ENTC      | Nashik   |
|     150 | Compueter | Pune     |
+---------+-----------+----------+
2 rows in set (0.00 sec)

mysql> set foreign_key_checks = 1;
Query OK, 0 rows affected (0.00 sec)

mysql> update project 
    -> set proj_cost = 10000
    -> where proj_location = 'Pune';
Query OK, 3 rows affected (0.01 sec)
Rows matched: 3  Changed: 3  Warnings: 0

mysql> select * from project;
+---------+---------+-------------------+---------------+-----------+-----------+
| proj_id | dept_id | proj_name         | proj_location | proj_cost | proj_year |
+---------+---------+-------------------+---------------+-----------+-----------+
|     344 |     100 | Expense Tracker   | Pune          |     10000 |      2004 |
|     345 |     100 | Health Consultant | Mumbai        |      5000 |      2005 |
|     346 |     150 | Crypto Tracker    | Mumbai        |      6000 |      2006 |
|     347 |     150 | Pattern Locking   | Pune          |     10000 |      2007 |
|     348 |      50 | File Finder       | Nashik        |      7000 |      2007 |
|     349 |      50 | Face Recognition  | Pune          |     10000 |      2008 |
+---------+---------+-------------------+---------------+-----------+-----------+
6 rows in set (0.00 sec)

mysql> select * from project
    -> where proj_cost between 5000 and 7000;
+---------+---------+-------------------+---------------+-----------+-----------+
| proj_id | dept_id | proj_name         | proj_location | proj_cost | proj_year |
+---------+---------+-------------------+---------------+-----------+-----------+
|     345 |     100 | Health Consultant | Mumbai        |      5000 |      2005 |
|     346 |     150 | Crypto Tracker    | Mumbai        |      6000 |      2006 |
|     348 |      50 | File Finder       | Nashik        |      7000 |      2007 |
+---------+---------+-------------------+---------------+-----------+-----------+
3 rows in set (0.01 sec)

mysql> select max(proj_cost) 
    -> as 'Maximum Project cost'
    -> from project;
+----------------------+
| Maximum Project cost |
+----------------------+
|                10000 |
+----------------------+
1 row in set (0.00 sec)

mysql> select avg(proj_cost)
    -> from project;
+----------------+
| avg(proj_cost) |
+----------------+
|      8000.0000 |
+----------------+
1 row in set (0.00 sec)

mysql> select emp_id, emp_fname, emp_lname
    -> from employe
    -> order by emp_lname desc;
+--------+-----------+-----------+
| emp_id | emp_fname | emp_lname |
+--------+-----------+-----------+
|    200 | Pat       | Ray       |
|    198 | Donald    | OConnell  |
|    202 | Harper    | Mavris    |
|    205 | Steven    | King      |
|    206 | Alexander | Hunold    |
|    203 | Shelly    | Higgins   |
|    201 | Peter     | Harstein  |
|    199 | Jennifer  | Grant     |
|    204 | William   | Geitz     |
|    207 | Harry     | Ernst     |
+--------+-----------+-----------+
10 rows in set (0.00 sec)

mysql> select proj_name, proj_location, proj_cost
    -> from project
    -> where proj_year in (2004, 2005, 2007);
+-------------------+---------------+-----------+
| proj_name         | proj_location | proj_cost |
+-------------------+---------------+-----------+
| Expense Tracker   | Pune          |     10000 |
| Health Consultant | Mumbai        |      5000 |
| Pattern Locking   | Pune          |     10000 |
| File Finder       | Nashik        |      7000 |
+-------------------+---------------+-----------+
4 rows in set (0.00 sec)

mysql> select count(*), emp_pos
    -> from employe
    -> group by emp_pos;
+----------+----------------+
| count(*) | emp_pos        |
+----------+----------------+
|        1 | Accountant     |
|        1 | Assistant      |
|        2 | Clerk          |
|        2 | Manager        |
|        3 | Programmer     |
|        1 | Representative |
+----------+----------------+
6 rows in set (0.00 sec)

mysql> update employe
    -> set emp_salary = emp_salary + emp_salary * 0.1;
Query OK, 10 rows affected (0.02 sec)
Rows matched: 10  Changed: 10  Warnings: 0

mysql> select * from employe;
+--------+---------+-----------+-----------+----------------+------------+--------------+
| emp_id | dept_id | emp_fname | emp_lname | emp_pos        | emp_salary | emp_joindate |
+--------+---------+-----------+-----------+----------------+------------+--------------+
|    198 |     150 | Donald    | OConnell  | Clerk          | 2860       | 2007-06-21   |
|    199 |     100 | Jennifer  | Grant     | Assistant      | 4840       | 2003-09-17   |
|    200 |      50 | Pat       | Ray       | Representative | 6600       | 2005-08-17   |
|    201 |     150 | Peter     | Harstein  | Manager        | 14300      | 2004-02-13   |
|    202 |     100 | Harper    | Mavris    | Programmer     | 11000      | 2002-06-07   |
|    203 |      50 | Shelly    | Higgins   | Manager        | 13200      | 2002-06-07   |
|    204 |     150 | William   | Geitz     | Accountant     | 9130       | 2008-01-13   |
|    205 |     100 | Steven    | King      | Clerk          | 2860       | 2003-07-17   |
|    206 |      50 | Alexander | Hunold    | Programmer     | 9900       | 2006-01-03   |
|    207 |     150 | Harry     | Ernst     | Programmer     | 5280       | 2021-05-14   |
+--------+---------+-----------+-----------+----------------+------------+--------------+
10 rows in set (0.00 sec)
